<?xml version="1.0" encoding="UTF-8"?>
<dataroot xmlns:od="urn:schemas-microsoft-com:officedata" xmlns:xsi="http://www.w3.org/2001/XMLSchema-instance"  xsi:noNamespaceSchemaLocation="Item.xsd" generated="2015-12-16T12:47:37">
<Item>
<ItemID>12</ItemID>
<ItemType>RELIC</ItemType>
<ItemName>Basic Palm Plate</ItemName>
<SubType>ARMOR</SubType>
<Quality>COMMON</Quality>
<MaxSize>1</MaxSize>
<Description>Glove relic</Description>
</Item>
<Item>
<ItemID>13</ItemID>
<ItemType>RELIC</ItemType>
<ItemName>Glove Piece</ItemName>
<SubType>ARMOR</SubType>
<Quality>COMMON</Quality>
<MaxSize>1</MaxSize>
<Description>Glove relic</Description>
</Item>
<Item>
<ItemID>1</ItemID>
<ItemType>CONSUMABLE</ItemType>
<ItemName>Health Potion</ItemName>
<SubType>HEALTH</SubType>
<Quality>COMMON</Quality>
<BaseStat1>50</BaseStat1>
<MaxSize>3</MaxSize>
<Description>Restores health</Description>
</Item>
<Item>
<ItemID>2</ItemID>
<ItemType>CONSUMABLE</ItemType>
<ItemName>Mana Potion</ItemName>
<SubType>MANA</SubType>
<Quality>COMMON</Quality>
<BaseStat1>50</BaseStat1>
<MaxSize>1</MaxSize>
<Description>Restores mana</Description>
</Item>
<Item>
<ItemID>3</ItemID>
<ItemType>EQUIPMENT</ItemType>
<ItemName>Basic Helmet</ItemName>
<SubType>HELM</SubType>
<Quality>COMMON</Quality>
<BaseStat1>75</BaseStat1>
<MaxSize>1</MaxSize>
<Description>Basic well balenced helm</Description>
<Relic01>Basic Face Plate</Relic01>
<Relic02>Helm Piece</Relic02>
</Item>
<Item>
<ItemID>4</ItemID>
<ItemType>RELIC</ItemType>
<ItemName>Basic Blade</ItemName>
<SubType>WEAPON</SubType>
<Quality>COMMON</Quality>
<MaxSize>1</MaxSize>
<Description>Sword relic</Description>
</Item>
<Item>
<ItemID>5</ItemID>
<ItemType>RELIC</ItemType>
<ItemName>Basic Face Plate</ItemName>
<SubType>ARMOR</SubType>
<Quality>COMMON</Quality>
<MaxSize>1</MaxSize>
<Description>Helm relic</Description>
</Item>
<Item>
<ItemID>6</ItemID>
<ItemType>RELIC</ItemType>
<ItemName>Helm Piece</ItemName>
<SubType>ARMOR</SubType>
<Quality>COMMON</Quality>
<MaxSize>1</MaxSize>
<Description>Helm relic</Description>
</Item>
<Item>
<ItemID>7</ItemID>
<ItemType>RELIC</ItemType>
<ItemName>Sword Hilt</ItemName>
<SubType>WEAPON</SubType>
<Quality>COMMON</Quality>
<MaxSize>1</MaxSize>
<Description>Sword relic</Description>
</Item>
<Item>
<ItemID>8</ItemID>
<ItemType>WEAPON</ItemType>
<ItemName>Basic Sword</ItemName>
<SubType>SWORD</SubType>
<Quality>COMMON</Quality>
<BaseStat1>25</BaseStat1>
<BaseStat2>10</BaseStat2>
<BaseStat3>10</BaseStat3>
<BaseStat4>1</BaseStat4>
<MaxSize>1</MaxSize>
<Description>Basic well balanced sword</Description>
<Relic01>Basic Blade</Relic01>
<Relic02>Sword Hilt</Relic02>
</Item>
<Item>
<ItemID>9</ItemID>
<ItemType>WEAPON</ItemType>
<ItemName>Great Sword</ItemName>
<SubType>SWORD</SubType>
<Quality>COMMON</Quality>
<BaseStat1>75</BaseStat1>
<BaseStat2>6</BaseStat2>
<BaseStat3>17</BaseStat3>
<BaseStat4>2</BaseStat4>
<MaxSize>1</MaxSize>
<Description>Large powerful sword, but very slow</Description>
<Relic01>Large Blade</Relic01>
<Relic02>Sword Hilt</Relic02>
</Item>
<Item>
<ItemID>10</ItemID>
<ItemType>WEAPON</ItemType>
<ItemName>Longsword</ItemName>
<SubType>SWORD</SubType>
<Quality>COMMON</Quality>
<BaseStat1>50</BaseStat1>
<BaseStat2>7</BaseStat2>
<BaseStat3>22</BaseStat3>
<BaseStat4>2</BaseStat4>
<MaxSize>1</MaxSize>
<Description>Great reach, but slower</Description>
<Relic01>Long Blade</Relic01>
<Relic02>Sword Hilt</Relic02>
</Item>
<Item>
<ItemID>11</ItemID>
<ItemType>EQUIPMENT</ItemType>
<ItemName>Basic Gloves</ItemName>
<SubType>GLOVES</SubType>
<Quality>COMMON</Quality>
<BaseStat1>25</BaseStat1>
<MaxSize>1</MaxSize>
<Description>Basic well balenced gloves</Description>
<Relic01>Basic Palm Plate</Relic01>
<Relic02>Glove piece</Relic02>
</Item>
</dataroot>
